[
  {
    "id": "sgz-zhaoyun-main",
    "kind": "三國志正文",
    "title": "《三國志‧蜀書‧關張馬黃趙傳》趙雲本傳",
    "note": "陳壽原文，卷三十六"
  },
  {
    "id": "yun-biezhuan",
    "kind": "裴松之注引",
    "title": "《雲別傳》",
    "note": "裴松之注《三國志‧趙雲傳》所引，原書已佚，僅存注文片段；作者及成書年代不詳，史料性質與正文不同，需獨立標註"
  },
  {
    "id": "sgz-houzhu",
    "kind": "三國志正文",
    "title": "《三國志‧蜀書‧後主傳》",
    "note": "《三國志・蜀書・後主傳》，記蜀漢後主劉禪在位期間的重要詔令與紀事，包含景耀年間多次追諡已故將領（關羽、張飛、馬超、龐統、黃忠等）；各人物頁使用時請看 citation 的 locator 判斷是哪一年、追諡何人。"
  },
  {
    "id": "sgz-guanzhang-mahuang-zhao-appraisal",
    "kind": "三國志正文",
    "title": "《三國志‧蜀書‧關張馬黃趙傳》陳壽評語",
    "note": "陳壽對關羽、張飛、馬超、黃忠、趙雲五人的卷末合評，非趙雲在世時的評價"
  },
  {
    "id": "jihan-fuchen-zan",
    "kind": "其他史籍",
    "title": "楊戲《季漢輔臣贊》",
    "note": "楊戲於延熙四年（241年）成篇，陳壽編修《三國志》時收錄；全篇分段對多位蜀漢文武大臣作四言合贊（如關羽與張飛合贊、趙雲與陳到合贊等），並非只評價單一人物，各人物頁使用時請看 citation 的 locator 判斷是哪一段。"
  },
  {
    "id": "sanguo-yanyi",
    "kind": "演義原文",
    "title": "《三國演義》",
    "note": "羅貫中章回小說，明清通行本"
  },
  {
    "id": "fan-sanguo-yanyi",
    "kind": "後世文學",
    "title": "周大荒《反三國演義》（又名《反三國志》）",
    "note": "民國文人周大荒所著白話章回小說，1930年結集出版，非史籍"
  },
  {
    "id": "sgz-liubei-main",
    "kind": "三國志正文",
    "title": "《三國志‧蜀書‧先主傳》",
    "note": "陳壽原文，卷三十二"
  },
  {
    "id": "sgz-liubei-appraisal",
    "kind": "三國志正文",
    "title": "《三國志‧蜀書‧先主傳》陳壽評語",
    "note": "卷末評語，非劉備在世時的評價"
  },
  {
    "id": "sgz-luxun-main",
    "kind": "三國志正文",
    "title": "《三國志‧吳書‧陸遜傳》",
    "note": ""
  },
  {
    "id": "sgz-zhuge-main",
    "kind": "三國志正文",
    "title": "《三國志‧蜀書‧諸葛亮傳》",
    "note": ""
  },
  {
    "id": "sgz-guanyu-main",
    "kind": "三國志正文",
    "title": "《三國志‧蜀書‧關羽傳》",
    "note": ""
  },
  {
    "id": "sgz-liufeng-main",
    "kind": "三國志正文",
    "title": "《三國志‧蜀書‧劉封傳》",
    "note": ""
  },
  {
    "id": "sgz-mizhu-main",
    "kind": "三國志正文",
    "title": "《三國志‧蜀書‧麋竺傳》",
    "note": ""
  },
  {
    "id": "sgz-pangtong-main",
    "kind": "三國志正文",
    "title": "《三國志‧蜀書‧龐統傳》",
    "note": ""
  },
  {
    "id": "sgz-shu-consorts",
    "kind": "三國志正文",
    "title": "《三國志‧蜀書‧二主妃子傳》",
    "note": "先主甘皇后傳、先主穆皇后傳"
  },
  {
    "id": "sgz-wendi-yiling",
    "kind": "三國志正文",
    "title": "《三國志‧魏書‧文帝紀》",
    "note": ""
  },
  {
    "id": "sgz-zhouyu-main",
    "kind": "三國志正文",
    "title": "《三國志‧吳書‧周瑜傳》",
    "note": ""
  },
  {
    "id": "jiuzhou-chunqiu-liubei",
    "kind": "裴松之注引",
    "title": "《九州春秋》",
    "note": "「髀肉復生」之嘆即出於此"
  },
  {
    "id": "weishu-liubei",
    "kind": "裴松之注引",
    "title": "《魏書》",
    "note": "王沈《魏書》，裴注引用時常與陳壽正文立場有出入，需對照參看"
  },
  {
    "id": "xiandi-chunqiu-liubei",
    "kind": "裴松之注引",
    "title": "《獻帝春秋》",
    "note": ""
  },
  {
    "id": "weilu-zhuge-visit",
    "kind": "裴松之注引",
    "title": "《魏略》",
    "note": "關於徐庶薦諸葛亮/三顧經過的異說，裴松之並加案語評論其可信度"
  },
  {
    "id": "dianlue-duyou",
    "kind": "裴松之注引",
    "title": "《典略》",
    "note": ""
  },
  {
    "id": "fuzi-liubei",
    "kind": "裴松之注引",
    "title": "《傅子》",
    "note": "傅玄所著"
  },
  {
    "id": "hanjin-chunqiu-sunfuren",
    "kind": "裴松之注引",
    "title": "《漢晉春秋》",
    "note": "習鑿齒所著"
  },
  {
    "id": "huayang-guozhi-thunder",
    "kind": "裴松之注引",
    "title": "《華陽國志》",
    "note": "常璩所著地方志，此處為裴注所引段落"
  },
  {
    "id": "shiyu-dilu",
    "kind": "裴松之注引",
    "title": "《世語》",
    "note": "郭頒《世語》，「的盧馬」相關記載；裴松之並附孫盛評語一併考辨"
  },
  {
    "id": "sunsheng-tuogu-comment",
    "kind": "裴松之注引",
    "title": "孫盛評語",
    "note": "東晉史家孫盛的史評，由裴松之注引錄"
  },
  {
    "id": "xizhaochi-liubei",
    "kind": "裴松之注引",
    "title": "習鑿齒評語",
    "note": "東晉史家習鑿齒（《漢晉春秋》作者）的史評，由裴松之注引錄"
  },
  {
    "id": "peisongzhi-yizhou-comment",
    "kind": "裴松之注引",
    "title": "裴松之案語（《三國志‧龐統傳》注）",
    "note": "裴松之本人的考證評論，非另外徵引其他書目"
  },
  {
    "id": "wulu-liubei-letter",
    "kind": "裴松之注引",
    "title": "《吳錄》",
    "note": ""
  },
  {
    "id": "wushu-yiling",
    "kind": "裴松之注引",
    "title": "《吳書》",
    "note": "韋昭等東吳史官所撰，裴注引用"
  },
  {
    "id": "zhuge-liang-ji-yizhao",
    "kind": "裴松之注引",
    "title": "《諸葛亮集》",
    "note": "陳壽奉敕編集的諸葛亮遺文，裴注引其中劉備遺詔敕後主全文"
  },
  {
    "id": "sgz-zhangfei-main",
    "kind": "三國志正文",
    "title": "《三國志‧蜀書‧張飛傳》",
    "note": ""
  },
  {
    "id": "sgz-zhuge-appraisal",
    "kind": "三國志正文",
    "title": "《三國志‧蜀書‧諸葛亮傳》陳壽評語",
    "note": "卷三十五末所附陳壽總評，屬西晉史家評價，不是諸葛亮在世時的直接評價"
  },
  {
    "id": "sgz-zhugejin-main",
    "kind": "三國志正文",
    "title": "《三國志‧吳書‧諸葛滕二孫濮陽傳》諸葛瑾傳",
    "note": "陳壽原文，卷五十二；用於諸葛瑾及諸葛氏親屬關係"
  },
  {
    "id": "sgz-wanglang-main",
    "kind": "三國志正文",
    "title": "《三國志‧魏書‧鍾繇華歆王朗傳》王朗傳",
    "note": "陳壽原文，卷十三；王朗於太和二年（228年）在魏國去世，正史沒有陣前被諸葛亮罵死之事"
  },
  {
    "id": "xiangyang-ji-zhuge",
    "kind": "裴松之注引",
    "title": "《襄陽記》",
    "note": "習鑿齒所撰，裴松之注《三國志‧諸葛亮傳》等篇時引用；涉及司馬徽論伏龍鳳雛、黃承彥嫁女、諸葛亮身後私祭與立廟等記載"
  },
  {
    "id": "xiandi-chunqiu-zhuge",
    "kind": "裴松之注引",
    "title": "《獻帝春秋》",
    "note": "一般歸於袁暐（又名袁曄），作者問題仍有異說；裴注所引諸葛玄任豫章太守及死亡經過，與《諸葛亮傳》正文有出入"
  },
  {
    "id": "jiuzhou-chunqiu-zhuge-visit",
    "kind": "裴松之注引",
    "title": "《九州春秋》",
    "note": "司馬彪所撰；關於諸葛亮主動北行見劉備的異說，大意與《魏略》相同，裴松之認為與《出師表》自述相衝突"
  },
  {
    "id": "hanjin-chunqiu-zhuge",
    "kind": "裴松之注引",
    "title": "《漢晉春秋》",
    "note": "習鑿齒所撰；裴注所引內容包括隆中位置、七縱七禽孟獲、北伐戰事及『死諸葛走生仲達』等"
  },
  {
    "id": "shuji-guochong",
    "kind": "裴松之注引",
    "title": "《蜀記》所載郭沖五事",
    "note": "郭沖所述五則諸葛亮逸事，裴松之逐條加以辨難，認為多有時地、人物與事理矛盾；其中第三事是後世空城計的相似文本，但不可視為可靠史實"
  },
  {
    "id": "weishu-zhuge-death",
    "kind": "裴松之注引",
    "title": "《魏書》",
    "note": "王沈等所撰曹魏官修史書；對諸葛亮末次北伐與死亡的記述帶有敵國誇勝色彩，裴松之明確質疑其『憂恚歐血』等說法"
  },
  {
    "id": "weishi-chunqiu-zhuge",
    "kind": "裴松之注引",
    "title": "《魏氏春秋》",
    "note": "孫盛所撰；裴注所引內容包括司馬懿由諸葛亮寢食與親攬細務推斷其將死"
  },
  {
    "id": "zhuge-liang-ji-zhuge",
    "kind": "裴松之注引",
    "title": "《諸葛亮集》（《亮集》）",
    "note": "陳壽奉敕編成的諸葛亮遺文集，原集已佚；裴松之注保存《正議》、木牛流馬法及若干書表片段"
  },
  {
    "id": "moji-hou-chushi-biao",
    "kind": "裴松之注引",
    "title": "張儼《默記》所錄〈後出師表〉",
    "note": "裴松之註明此表不見於陳壽所編《諸葛亮集》，而出自張儼《默記》；故傳統歸於諸葛亮，但作者真偽與文字來源需保留疑問"
  },
  {
    "id": "taiping-yulan-459",
    "kind": "其他史籍",
    "title": "《太平御覽》卷四百五十九",
    "note": "北宋李昉等奉敕編纂的類書，保存傳為諸葛亮所作〈誡子書〉與〈誡外甥書〉；現存可核文本距三國時代較晚，歸屬可信度不及《三國志》所收〈出師表〉"
  },
  {
    "id": "dufu-shuxiang",
    "kind": "後世文學",
    "title": "杜甫〈蜀相〉",
    "note": "唐代杜甫遊成都武侯祠所作七律，為後世歌詠諸葛亮君臣際遇與未竟北伐的代表作品"
  },
  {
    "id": "shin-sangokumusou-3-yueying",
    "kind": "現代遊戲",
    "title": "光榮《真‧三國無雙3》月英角色設定",
    "note": "2003年推出，將諸葛亮之妻以『月英』之名塑造成遊戲角色，強化了此後世傳說名在當代大眾文化中的普及；不能據此認定其為歷史本名"
  },
  {
    "id": "sgz-sunjian-main",
    "kind": "三國志正文",
    "title": "《三國志‧吳書‧孫破虜討逆傳》孫堅本傳",
    "note": "陳壽原文，卷四十六；用於核對陽人之戰與華雄之死"
  },
  {
    "id": "sgz-wuzhu-main",
    "kind": "三國志正文",
    "title": "《三國志‧吳書‧吳主傳》",
    "note": "陳壽原文，卷四十七；用於核對湘水分界、孫權襲荊州、麥城與關羽被擒經過"
  },
  {
    "id": "sgz-lusu-main",
    "kind": "三國志正文",
    "title": "《三國志‧吳書‧周瑜魯肅呂蒙傳》魯肅本傳",
    "note": "陳壽原文，卷五十四；用於核對建安二十年益陽『單刀俱會』的談判經過"
  },
  {
    "id": "weilu-xiahoushi",
    "kind": "裴松之注引",
    "title": "《魏略》所載張飛妻夏侯氏事",
    "note": "裴松之注《三國志‧夏侯淵傳》引文，原書已佚；記夏侯霸從妹為張飛所得、成為其妻並生女為劉禪皇后"
  },
  {
    "id": "yingxiongji-xuzhou",
    "kind": "裴松之注引",
    "title": "《英雄記》所載張飛守下邳與徐州失守事",
    "note": "裴松之注《三國志‧先主傳》引文，原書已佚；記劉備留張飛守下邳、張飛欲殺曹豹，曹豹招引呂布"
  },
  {
    "id": "sgz-zhangliao-main",
    "kind": "三國志正文",
    "title": "《三國志‧魏書‧張樂于張徐傳》張遼本傳",
    "note": "陳壽原文，卷十七；張遼生平、官爵、合肥戰事、病逝及後嗣的核心史料"
  },
  {
    "id": "sgz-weishu17-appraisal",
    "kind": "三國志正文",
    "title": "《三國志‧魏書‧張樂于張徐傳》陳壽評語",
    "note": "卷十七卷末對張遼、樂進、于禁、張郃、徐晃五將的合評，屬西晉史家評價"
  },
  {
    "id": "sgz-yuejin-main",
    "kind": "三國志正文",
    "title": "《三國志‧魏書‧張樂于張徐傳》樂進本傳",
    "note": "陳壽原文，卷十七；保存建安十一年曹操合稱樂進、于禁、張遼並為三人表功的文字"
  },
  {
    "id": "sgz-taishici-main",
    "kind": "三國志正文",
    "title": "《三國志‧吳書‧太史慈傳》",
    "note": "陳壽原文，卷四十九；用於核對太史慈卒年及小說所寫合肥中伏之差異"
  },
  {
    "id": "fuzi-zhangliao-guanyu",
    "kind": "裴松之注引",
    "title": "《傅子》",
    "note": "傅玄所著；裴松之注《三國志‧關羽傳》所引，補述張遼在是否據實回報關羽去留之意時的猶豫與判斷"
  },
  {
    "id": "sunsheng-hefei-comment",
    "kind": "裴松之注引",
    "title": "孫盛評合肥守戰",
    "note": "東晉史家孫盛的軍事評論，由裴松之注於《三國志‧張遼傳》合肥戰事後引錄"
  },
  {
    "id": "weilue-zhangliao-via-taiping-yulan",
    "kind": "其他史籍",
    "title": "《太平御覽》引《魏略》張遼止啼佚文",
    "note": "《魏略》原書已佚，此段由北宋類書《太平御覽》卷四百八十八〈人事部・啼〉保存；不是《三國志》正文，也未見於現存《三國志》裴注，引用時須標明轉引層級"
  },
  {
    "id": "zhang-xingcai-koei",
    "kind": "現代遊戲",
    "title": "《三國殺》『張星彩』官方人物頁；光榮《真・三國無雙》系列『星彩』角色介紹",
    "note": "『張星彩』並非《三國志》或《三國演義》記載的本名，是現代遊戲創作的稱呼，且不同作品對其原型指涉不一致：《三國殺》官方人物頁明確將她設定為張飛長女、劉禪第一任皇后（即敬哀皇后）；光榮《真・三國無雙》系列官方人物介紹僅稱『張飛之女』『劉禪之妻』，未明確區分是長女或次女，不宜逕自等同其中一人。坊間流傳『星彩』一名源自對諡號『敬哀』的日語諧音之說，查無光榮官方或其他可靠一手資料佐證（『星彩』讀作せいさい・Seisai，『敬哀』讀作けいあい・Keiai，實際讀音也不如坊間所稱相近），故不予採信收錄。"
  },
  {
    "id": "jiangbiao-zhuan-zhouyu",
    "kind": "裴松之注引",
    "title": "《江表傳》所載周瑜事",
    "note": "裴松之注《三國志・周瑜傳》引文；保存孫策稱周瑜與己有『總角之好，骨肉之分』、周瑜曾發眾及船糧相助、孫策戲言二橋婚事、程普由不服轉為敬服、蔣幹說周瑜不成，以及周瑜臨終箋等材料。原書已佚，須與《三國志》正文分層標示。"
  },
  {
    "id": "sgz-chengpu-main",
    "kind": "三國志正文",
    "title": "《三國志・吳書・程普傳》",
    "note": "陳壽原文，卷五十五；明載程普與周瑜『為左右督』，共同破曹操於烏林、進攻南郡，用於界定赤壁前線指揮層級。"
  },
  {
    "id": "sgz-wushu54-appraisal",
    "kind": "三國志正文",
    "title": "《三國志・吳書・周瑜魯肅呂蒙傳》陳壽評語",
    "note": "卷五十四卷末合評；稱周瑜、魯肅在眾議疑懼時具有獨斷之明，屬西晉史家評價，不是周瑜在世時的直接評語。"
  },
  {
    "id": "yin-dan-weiji-tongquetai-fu",
    "kind": "裴松之注引",
    "title": "陰澹《魏紀》所載曹植〈銅爵臺賦〉",
    "note": "裴松之注《三國志・曹植傳》引文。現存引文沒有『二喬／二橋』，更沒有曹操欲奪孫策、周瑜配偶之意；可用來核對《三國演義》第四十四回改寫的〈銅雀臺賦〉。"
  },
  {
    "id": "dumu-chibi",
    "kind": "後世文學",
    "title": "杜牧〈赤壁〉",
    "note": "唐代七言絕句，以『東風不與周郎便，銅雀春深鎖二喬』反設赤壁勝負；這是詩人對歷史結果的文學想像，不能證明曹操生前曾以奪取二喬為伐吳目的。"
  },
  {
    "id": "sgz-jiangwei-main",
    "kind": "三國志正文",
    "title": "《三國志・蜀書・蔣琬費禕姜維傳》姜維本傳",
    "note": "陳壽原文，卷四十四；為姜維出身、仕魏、歸蜀、官職沿革、歷次出兵、漢中防禦改制、劍閣守戰、降鍾會與成都之亂等事的核心來源。"
  },
  {
    "id": "sgz-shu44-appraisal",
    "kind": "三國志正文",
    "title": "《三國志・蜀書・蔣琬費禕姜維傳》陳壽評語",
    "note": "卷四十四卷末合評；對姜維的文武能力、立功之志與長期用兵作出總評，屬西晉史家評價，不是姜維在世時的言論。"
  },
  {
    "id": "weilue-jiangwei",
    "kind": "裴松之注引",
    "title": "《魏略》所載姜維歸蜀事",
    "note": "裴松之注《三國志・姜維傳》引文；與正文在天水太守馬遵的行程、姜維回冀縣的原因及其母妻子處置等細節上有異，但同樣顯示姜維並非預先蓄意叛魏。原書已佚。"
  },
  {
    "id": "fuzi-jiangwei",